{
  "$schema": "https://json-schema.org/draft/2020-12/schema",
  "$id": "https://shield.tesseract/schema/plan-sidecar/1.2",
  "title": "Shield plan.json sidecar — schema 1.2",
  "description": "Machine-readable counterpart of shield/skills/general/plan-docs/sidecar-schema.md. Source of truth for shield/scripts/validate_plan.py.",
  "type": "object",
  "required": ["version", "project", "name", "epics"],
  "additionalProperties": true,
  "properties": {
    "version": {
      "description": "Schema version. Older clients (1.0, 1.1) are accepted in back-compat mode; newer versions trigger a forward-compat warning.",
      "type": "string",
      "pattern": "^[0-9]+\\.[0-9]+$"
    },
    "project": { "type": "string", "minLength": 1 },
    "name": {
      "type": "string",
      "pattern": "^[a-z0-9-]+$"
    },
    "phase": { "type": ["string", "null"] },
    "source_research": { "type": ["string", "null"] },
    "source_prd": { "type": ["string", "null"] },
    "prd_rubric_version_at_planning": { "type": ["string", "null"] },
    "last_aligned_with": {
      "description": "Schema 1.3+ — git commit SHA of the most recent /implement run that closed a story. Null until first close.",
      "oneOf": [
        { "type": "null" },
        { "type": "string", "pattern": "^[0-9a-f]{40}$" }
      ]
    },
    "milestones": {
      "type": "array",
      "items": { "$ref": "#/$defs/milestone" }
    },
    "epics": {
      "type": "array",
      "minItems": 1,
      "items": { "$ref": "#/$defs/epic" }
    },
    "metadata": { "type": "object" }
  },
  "$defs": {
    "milestone": {
      "type": "object",
      "required": ["id", "name", "outcome", "exit_criteria"],
      "additionalProperties": true,
      "properties": {
        "id":      { "type": "string", "pattern": "^M[0-9]+$" },
        "name":    { "type": "string", "minLength": 1 },
        "outcome": { "type": "string", "minLength": 1 },
        "exit_criteria": {
          "type": "array",
          "minItems": 1,
          "items": { "type": "string", "minLength": 1 }
        },
        "depends_on": {
          "type": "array",
          "items": { "type": "string", "pattern": "^M[0-9]+$" }
        }
      }
    },
    "epic": {
      "type": "object",
      "required": ["id", "name", "stories"],
      "additionalProperties": true,
      "properties": {
        "id":      { "type": "string", "pattern": "^EPIC-[0-9]+$" },
        "name":    { "type": "string", "minLength": 1 },
        "stories": {
          "type": "array",
          "minItems": 1,
          "items": { "$ref": "#/$defs/story" }
        }
      }
    },
    "story": {
      "type": "object",
      "required": ["id", "name", "status", "description", "tasks", "acceptance_criteria"],
      "additionalProperties": true,
      "properties": {
        "id":          { "type": "string", "pattern": "^EPIC-[0-9]+-S[0-9]+$" },
        "name":        { "type": "string", "minLength": 1 },
        "status":      { "type": "string", "enum": ["ready", "in-progress", "in-review", "done", "blocked"] },
        "assignee":    { "type": ["string", "null"] },
        "priority":    { "type": ["string", "null"], "enum": ["low", "medium", "high", null] },
        "week":        { "type": ["string", "integer", "null"] },
        "milestone_id": {
          "oneOf": [
            { "type": "null" },
            { "type": "string", "pattern": "^M[0-9]+$" }
          ]
        },
        "description": { "type": "string", "minLength": 1 },
        "tasks": {
          "type": "array",
          "minItems": 1,
          "items": { "type": "string", "minLength": 1 }
        },
        "acceptance_criteria": {
          "type": "array",
          "minItems": 1,
          "items": { "type": "string", "minLength": 1 }
        },
        "design_refs": {
          "type": "array",
          "items": { "$ref": "#/$defs/design_ref" }
        },
        "pm_id":  { "type": ["string", "null"] },
        "pm_url": { "type": ["string", "null"] }
      }
    },
    "design_ref": {
      "type": "object",
      "required": ["doc", "label"],
      "additionalProperties": true,
      "properties": {
        "doc":        { "type": "string", "enum": ["trd", "lld", "prd"] },
        "component":  { "type": ["string", "null"] },
        "section_id": { "type": ["string", "null"] },
        "anchor_url": { "type": ["string", "null"] },
        "label":      { "type": "string", "minLength": 1 },
        "stale":      { "type": "boolean" }
      }
    }
  }
}
