{
  "version": "1.1",
  "project": "shield",
  "name": "legacy",
  "epics": [
    {
      "id": "EPIC-1",
      "name": "Legacy epic",
      "stories": [
        {
          "id": "EPIC-1-S1",
          "name": "Legacy story",
          "status": "ready",
          "description": "Pre-1.4 story.",
          "tasks": ["t"],
          "acceptance_criteria": ["a"]
        }
      ]
    }
  ]
}
