{
  "version": "1.4",
  "project": "shield",
  "name": "pm-sync-sidecar",
  "milestones": [
    {
      "id": "M1",
      "name": "MS one",
      "outcome": "ships X",
      "exit_criteria": ["X exists"]
    }
  ],
  "epics": [
    {
      "id": "EPIC-1",
      "name": "Epic name",
      "pm_id": "86abc123",
      "pm_url": "https://app.clickup.com/t/86abc123",
      "stories": [
        {
          "id": "EPIC-1-S1",
          "name": "Do the first thing",
          "status": "ready",
          "description": "Does the first thing.",
          "tasks": ["step 1"],
          "acceptance_criteria": ["it works"],
          "milestone_id": "M1",
          "pm_id": "86abc1s1",
          "pm_url": "https://app.clickup.com/t/86abc1s1"
        },
        {
          "id": "EPIC-1-S2",
          "name": "Do the second thing",
          "status": "ready",
          "description": "Does the second thing.",
          "tasks": ["step 1"],
          "acceptance_criteria": ["it works"],
          "milestone_id": "M1",
          "pm_id": "86abc1s2",
          "pm_url": "https://app.clickup.com/t/86abc1s2"
        }
      ]
    }
  ]
}
